1,Father,"Alright son, let's play a game of chess",2
2,Son,"Awesome, I've been wanting to play chess with you for a long time.",2
3,Father,"Great! Now remember, the objective of the game is to checkmate your opponent's king.",2
4,Son,"I know, I know. Let's start!",2
5,Father,"Okay, it's your turn. What move do you want to make?",2
6,Son,I think I'll move my knight to E5.,2
7,Father,"That's a good move. But watch out, I might capture it with my bishop",2
8,Son,"I know, but I have a plan.",2
9,Father,"Well then, let's see how it plays out.",2
10,Son,"Dad, why did you move your queen to H5?",2
11,Father,"Because I want to put your king in check. And if you don't make a move to get out of check, I'll win the game.",2
12,Son,"I see, but I have a way to get out of check. I'll move my bishop to block your queen.",2
13,Father,"Well done, son. You're learning quickly.",2
14,Father,"It looks like you have me in checkmate, son. Well played.",2
15,Son,"Thanks, dad! I couldn't have done it without your guidance.",2
16,Father,"Anytime, son. Remember, chess is all about strategy and making the right moves at the right time.",2
17,Son,"I'll remember that, dad. Can we play again tomorrow?",2
18,Father,Of course! I look forward to our next game.,2